dates,url,title,scores
2019-03-14,https://www.businessinsider.com/tesla-model-y-price-predictions-2019-3,Tesla is about to reveal the Model Y — here's how much it could cost (TSLA),0.059745454545454546
2019-04-08,https://www.businessinsider.com/tesla-mercedes-benz-autonomous-car-gaming-2019-4,"Gaming will be a key differentiator in autonomous vehicles (TSLA, DDAIF, AUDVF, PONGF)",0.3182
2019-04-05,https://www.businessinsider.com/tesla-stock-price-to-plunge-80-biggest-bear-says-2019-4,Wall Street's biggest Tesla bear says shares are going to crater 80% to $54 (TSLA),-0.15552307692307693
2019-03-19,https://www.businessinsider.com/stock-market-news-opening-bell-march-19-2019-2019-3,"10 things you need to know before the opening bell (SPY, SPX, QQQ, DIA, TSLA, TLRY)",0.0
2019-03-12,https://www.businessinsider.com/tesla-stock-price-elon-musk-electric-car-maker-demand-slowdown-2019-3,"Tesla is facing an 'air pocket' in demand earlier than expected, Morgan Stanley says (TSLA)",-0.1097
2019-03-15,https://www.businessinsider.com/teslas-financial-problems-return-2019-2019-3,Wall Street is worried that Tesla's going broke yet again (TSLA),0.016917187500000007
2019-03-18,https://www.businessinsider.com/tesla-model-y-crossover-suv-2019-3,Tesla's Model Y pulls from the Model 3's playbook (TSLA),0.35530952380952385
2019-03-20,https://www.businessinsider.com/nvidia-expands-av-tech-footprint-2019-3,"Why Nvidia is broadening its AV portfolio (NVDA, TSLA, TM, VLVLY, AUDVF)",0.13939374999999998
2019-04-04,https://www.businessinsider.com/tesla-elon-musk-sec-court-hearing-live-2019-4,LIVE: Elon Musk has arrived at court to face off against the SEC (TSLA),-0.011375609756097563
2019-04-09,https://www.businessinsider.com/tesla-senior-director-of-global-security-leaves-company-2019-4,Tesla's senior director of global security has left the company (TSLA),0.23828571428571424
2019-03-30,https://www.businessinsider.com/tesla-proof-next-20-years-in-tech-industry-wont-be-like-last-20-2019-3,Tesla is proof that the next 20 years in the tech industry won't be like the last 20 (TSLA),0.006987999999999997
2019-03-22,https://www.businessinsider.com/stock-market-news-opening-bell-march-22-2019-2019-3,"10 things you need to know before the opening bell (SPY, SPX, QQQ, DIA, TSLA, BA, NKE, LEVI)",0.0
2019-03-18,https://www.businessinsider.com/stock-market-news-opening-bell-march-18-2019-2019-3,"10 things you need to know before the opening bell (SPY, SPX, QQQ, DIA, TSLA, F, WP, FIS)",0.4084
2019-04-05,https://www.businessinsider.com/stock-market-news-opening-bell-april-5-2019-2019-4,"10 things you need to know before the opening bell (SPY, SPX, QQQ, DIA, TSLA, BA, AMZN, TW)",0.07284285714285714
2019-03-27,https://www.businessinsider.com/elon-musk-emails-tesla-employees-closing-retail-stores-2019-3,Elon Musk just emailed all Tesla employees to 'clear things up' about the company's plan to close stores (TSLA),0.027938095238095248
2019-03-21,https://www.businessinsider.com/tesla-sues-former-employees-zoox-alleging-theft-of-confidential-info-2019-3,"Tesla is suing former employees, accusing them of stealing confidential information and giving it to robo-taxi rival Zoox (TSLA)",-0.195065
2019-03-19,https://www.businessinsider.com/tesla-factory-workers-lost-more-time-injury-and-illness-2018-2019-3,Tesla factory workers took twice as many days off last year than in 2017 because of injury or sickness (TSLA),-0.4215
2019-03-15,https://www.businessinsider.com/tesla-model-y-design-and-specs-details-2019-3,The Tesla Model Y has staggering specs — but it isn't a major new design for Tesla (TSLA),0.032873333333333345
2019-03-12,https://markets.businessinsider.com/news/stocks/stock-market-news-opening-bell-march-12-2019-2019-3-1028022340,"10 things you need to know before the opening bell (SPY, SPX, QQQ, DIA, TSLA, BA, AAPL, WFC, SFIX)",0.067104
2019-04-04,https://www.businessinsider.com/elon-musk-says-he-will-probably-settle-with-sec-in-next-2-weeks-2019-4,Elon Musk said he'll probably reach a new settlement with the SEC in the next 2 weeks (TSLA),-0.1703807692307692
2019-03-31,https://www.businessinsider.com/nio-es8-tesla-model-x-comparison-photos-specs-2019-3,"Nio is Tesla's biggest competitor in the Chinese electric-vehicle market — here's how its ES8 SUV compares with Tesla's Model X (NIO, TSLA)",0.08733428571428573
2019-03-12,https://www.businessinsider.com/musk-response-to-contempt-of-court-2019-3,"MUSK FILES HIS DEFENSE: Says SEC seeks to violate his First Amendment rights, and its filing 'smacks of retaliation and censorship' (TSLA)",-0.07181999999999998
2019-03-15,https://www.businessinsider.com/tesla-stock-price-model-ys-impact-on-model-3-according-to-analysts-2019-3,Wall Street is warning Tesla's new SUV could 'cannibalize' its Model 3. Here's what analysts are saying about the Model Y. (TSLA),-0.007012000000000005
2019-03-27,https://www.businessinsider.com/elon-musk-and-sec-battle-timeline-2019-3,Elon Musk and the SEC are in a nasty battle over one of Musk's tweets — here's what you need to know about their dispute (TSLA),-0.105105
2019-03-11,https://www.businessinsider.com/former-tesla-employee-files-whistleblowing-tip-with-sec-2019-3,A former Tesla employee has filed a whistleblowing tip with the SEC alleging that Tesla workers were skeptical of the deal mentioned in Elon Musk's 'funding secured' tweet (TSLA),0.06447272727272726
2019-03-18,https://www.businessinsider.com/tesla-stock-options-trade-recommendation-investors-overlooking-elon-musk-legal-woes-jpmorgan-2019-3,JPMORGAN: Tesla investors are ignoring the possibility that CEO Elon Musk will be forced out. Here's how they can protect against that worst-case scenario.,-0.00034000000000000767
2019-04-03,https://www.businessinsider.com/tesla-to-host-autonomy-investor-day-april-19-2019-4,Tesla will host an 'autonomy investor day' this month (TSLA),-0.08470833333333333
2019-03-15,https://markets.businessinsider.com/news/stocks/tesla-stock-price-drops-after-model-y-suv-unveiling-2019-3-1028034431,Tesla sinks after analysts were underwhelmed by the long-awaited Model Y unveiling (TSLA),0.04476
2019-03-25,https://markets.businessinsider.com/news/stocks/tesla-stock-price-analyst-cuts-target-demand-delivery-issues-2019-3-1028056131,Analyst slashes his Tesla price target due to 'meager demand' and Model 3 'delivery issues' (TSLA),0.001827272727272728
2019-03-22,https://www.businessinsider.com/tesla-removes-standard-range-model-s-from-website-2019-3,Tesla quietly deleted the standard range Model S option from its website (TSLA),-0.061629411764705884
2019-04-04,https://markets.businessinsider.com/news/stocks/millennials-tesla-deliveries-drop-2019-4-1028087242,Millennials were unloading their Tesla shares ahead of its disappointing first-quarter deliveries (TSLA),0.05479090909090909
2019-04-08,https://www.businessinsider.com/tesla-stock-price-morgan-stanley-adam-jonas-cuts-target-again-2019-4,Morgan Stanley slashes its Tesla target for the 3rd time this year (TSLA),0.006050000000000002
2019-03-11,https://www.businessinsider.com/tesla-stock-price-reducing-number-store-closures-raising-prices-2019-3,Tesla slips after saying it's reducing the number of store closures and raising prices (TSLA),-0.059372727272727265
2019-03-15,https://www.businessinsider.com/tesla-stock-price-drops-after-model-y-suv-unveiling-2019-3,Tesla sinks after analysts were underwhelmed by the long-awaited Model Y unveiling (TSLA),-0.12910000000000002
2019-03-13,https://www.businessinsider.com/tesla-lays-off-150-recruitment-employees-2019-3,Tesla just laid off 150 recruitment workers as part of its broader cost cutting (TSLA),0.07289047619047619
2019-03-23,https://www.businessinsider.com/why-model-y-is-teslas-most-important-car-2019-3,Tesla just launched the Model Y — here's why it's the company's most important car (TSLA),0.2220625
2019-04-04,https://www.businessinsider.com/tesla-stock-price-deliveries-fall-short-wall-street-weighs-in-2019-4,Tesla analysts are piling on after disappointing delivery numbers sent the stock plunging (TSLA),0.012975
2019-03-15,https://www.businessinsider.com/tesla-model-y-suv-will-outsell-model-s-model-3-elon-musk-says-2019-3,Elon Musk says Tesla's new Model Y SUV will outsell the Model S and Model 3 combined (TSLA),0.10795531914893618
2019-03-21,https://www.businessinsider.com/tesla-stock-price-gigafactory-fremont-factory-toured-by-analyst-2019-3,A Tesla analyst who just toured the electric-car maker's California and Nevada factories reveals what he saw (TSLA),0.10316249999999999
2019-03-15,https://www.businessinsider.com/elon-musk-wore-tesla-branded-jordan-sneaker-made-from-python-skin-2019-3,Elon Musk wore custom Tesla-branded Jordan sneakers made of python skin at the company's Model Y unveiling (TSLA),-0.14695833333333333
2019-03-15,https://www.businessinsider.com/tesla-model-y-suv-production-timeline-2019-3,"Tesla opens up orders for its long-awaited Model Y SUV, but production won't begin for a while (TSLA)",0.014078947368421054
2019-03-10,https://www.businessinsider.com/teslas-closing-all-its-stores-and-sell-online-might-be-brilliant-2019-3,Tesla's decision to close all its stores and sell cars online only sounds crazy — but it might be brilliant (TSLA),0.3257615384615385
2019-03-16,https://www.businessinsider.com/elon-musk-proves-he-greatest-car-salesman-tesla-model-y-reveal-2019-3,Elon Musk just revealed the Tesla Model Y — and he's still the greatest car salesman who ever lived (TSLA),0.6369
2019-04-10,https://www.businessinsider.com/tesla-analyst-nomura-eberle-compares-company-to-salesforce-2019-4,The latest Wall Street analyst to launch coverage of Tesla says investors should compare it to an unlikely tech giant (TSLA),0.07153571428571429
2019-04-04,https://www.businessinsider.com/sec-reveals-punishment-it-wants-for-elon-musk-2019-4,The SEC revealed the punishment it wants Elon Musk to face if he violates the terms of their settlement in the future (TSLA),-0.06204117647058823
2019-03-17,https://markets.businessinsider.com/news/stocks/tesla-stock-price-fundamental-shift-in-trading-2019-3-1028035861,Tesla's stock doesn't trade like it used to (TSLA),0.05215357142857141
2019-04-10,https://markets.businessinsider.com/news/stocks/tesla-rises-on-news-that-the-tax-credit-may-be-extended-2019-4-1028101148,Tesla pops after news that the tax credit for electric vehicles may be extended (TSLA),0.3818
2019-03-21,https://www.businessinsider.com/stock-market-news-opening-bell-march-21-2019-2019-3,"10 things you need to know before the opening bell (SPY, SPX, QQQ, DIA, TSLA)",-0.03647142857142858
2019-04-08,https://www.businessinsider.com/tesla-lays-off-dozens-of-salespeople-april-2019-4,Tesla laid off dozens of salespeople after its disappointing Q1 delivery report (TSLA),0.0655875
2019-04-01,https://www.businessinsider.com/tesla-hackers-steer-into-oncoming-traffic-with-stickers-on-the-road-2019-4,Hackers steered a Tesla into oncoming traffic by placing three small stickers on the road (TSLA),0.017736363636363637
2019-03-15,https://www.businessinsider.com/tesla-reveals-model-y-details-specs-2019-3,"Elon Musk just unveiled Tesla's newest car, the Model Y SUV (TSLA)",0.0
2019-03-13,https://www.businessinsider.com/stock-market-news-opening-bell-march-13-2019-2019-3,"10 things you need to know before the opening bell (SPY, SPX, QQQ, DIA, BA, TSLA)",0.0
2019-03-13,https://www.businessinsider.com/boeing-stock-price-sliding-after-trump-issues-order-to-ground-the-737-max-2019-3,Boeing is sliding after Trump issued an emergency order to ground the 737 Max planes (TSLA),-0.3818
2019-04-05,https://www.businessinsider.com/elon-musk-ordered-by-judge-to-meet-with-sec-for-at-least-one-hour-2019-4,Judge orders Elon Musk to meet with the SEC 'for at least one hour' (TSLA),-0.06704444444444448
2019-03-19,https://www.businessinsider.com/tesla-delays-3-price-increase-for-cars-until-wednesday-2019-3,Tesla is delaying a 3% price increase until Wednesday (TSLA),0.030736
2019-03-18,https://markets.businessinsider.com/news/stocks/stock-market-news-opening-bell-march-18-2019-2019-3-1028037246,"10 things you need to know before the opening bell (SPY, SPX, QQQ, DIA, TSLA, F, WP, FIS)",-0.11818000000000001
2019-03-15,https://markets.businessinsider.com/news/stocks/stock-market-news-opening-bell-march-15-2019-2019-3-1028033597,"10 things you need to know before the opening bell (SPY, SPX, QQQ, DIA, TSLA, BA, AAPL, ULTA)",0.11111176470588235
2019-03-11,https://www.businessinsider.com/stock-market-news-opening-bell-march-11-2019-2019-3,"10 things you need to know before the opening bell (SPY, SPX, QQQ, DIA, BA, TSLA, NVDA, MLNX, AMZN)",0.0
2019-03-23,https://www.businessinsider.com/teslas-biggest-challenges-in-2019-2019-3,Tesla is having another chaotic year — these are the biggest challenges Tesla has faced so far in 2019 (TSLA),0.07612307692307692
2019-03-22,https://markets.businessinsider.com/news/stocks/stock-market-news-opening-bell-march-22-2019-2019-3-1028051576,"10 things you need to know before the opening bell (SPY, SPX, QQQ, DIA, TSLA, BA, NKE, LEVI)",0.024872727272727258
2019-03-13,https://markets.businessinsider.com/news/stocks/tesla-stock-price-model-y-could-weaken-model-3-demand-2019-3-1028027670,Goldman Sachs says Tesla's new Model Y SUV could make its Model 3 demand problems even worse (TSLA),-0.2490375
2019-03-12,https://www.businessinsider.com/tesla-semi-reservations-available-on-website-2019-3,"Tesla customers can now pay up to $200,000 to reserve the electric Semi truck on the company's website (TSLA)",-0.1027
2019-03-27,https://www.businessinsider.com/stock-market-news-opening-bell-march-27-2019-2019-3,"10 things you need to know before the opening bell (SPY, SPX, QQQ, DIA, TSLA, HMNY)",-0.03925185185185186
2019-03-14,http://markets.businessinsider.com/news/stocks/Tesla-stock-is-gaining-ground-ahead-of-its-Model-Y-unveiling-TSLA-1028031435,Tesla stock is gaining ground ahead of its Model Y unveiling (TSLA),0.016565306122448976
2019-04-04,https://www.businessinsider.com/millennials-tesla-deliveries-drop-2019-4,Millennials were unloading their Tesla stock ahead of the disappointing first-quarter deliveries (TSLA),0.26055384615384614
2019-04-04,https://www.businessinsider.com/jpmorgan-tesla-just-undermined-elon-musks-defense-against-the-sec-2019-4,JPMORGAN: Tesla just undermined Elon Musk's defense against the SEC (TSLA),-0.21278181818181816
2019-03-21,https://markets.businessinsider.com/news/stocks/stock-market-news-opening-bell-march-21-2019-2019-3-1028048218,"10 things you need to know before the opening bell (SPY, SPX, QQQ, DIA, TSLA)",0.09723793103448275
2019-04-09,https://www.businessinsider.com/tesla-stock-price-where-wall-street-analysts-stand-2019-4,Tesla is a battleground stock. Here's where major Wall Street analysts stand right now. (TSLA),-0.13396666666666665
2019-04-04,https://www.businessinsider.com/tesla-is-singlehandedly-growing-electric-car-market-despite-bad-quarter-2019-4,"Despite a bad quarter, Tesla is singlehandedly growing the sluggish electric-car market (TSLA)",0.2144
2019-04-04,https://www.businessinsider.com/tesla-updates-navigate-on-autopilot-car-feature-2019-4,Tesla just updated its ‘Navigate on Autopilot’ feature — here’s what’s new (TSLA),-0.07734999999999999
2019-04-10,https://www.businessinsider.com/tesla-rises-on-news-that-the-tax-credit-may-be-extended-2019-4,Tesla pops after news that the tax credit for electric vehicles may be extended (TSLA),0.03329473684210525
2019-04-03,https://www.businessinsider.com/tesla-model-s-driving-with-no-one-behind-the-wheel-2019-4,Video appears to show a Tesla Model S traveling on the road at speed with no one in the driver's seat (TSLA),-0.045450000000000004
2019-04-04,https://www.businessinsider.com/tesla-disappointing-q1-sales-not-reason-to-panic-2019-4,"Tesla's disappointing first-quarter sales numbers aren't a reason to panic, but they reveal big challenges for the company, experts say (TSLA)",0.02916000000000001
2019-03-11,https://markets.businessinsider.com/news/stocks/stock-market-news-opening-bell-march-11-2019-2019-3-1028018490,"10 things you need to know before the opening bell (SPY, SPX, QQQ, DIA, BA, TSLA, NVDA, MLNX, AMZN)",0.0
2019-03-15,https://www.businessinsider.com/stock-market-news-opening-bell-march-15-2019-2019-3,"10 things you need to know before the opening bell (SPY, SPX, QQQ, DIA, TSLA, BA, AAPL, ULTA)",0.07837142857142858
2019-03-27,https://www.businessinsider.com/elon-musk-contradicts-teslas-return-policy-on-twitter-2019-3,Elon Musk contradicts Tesla's return policy on Twitter (TSLA),-0.34
2019-03-17,https://www.businessinsider.com/tesla-stock-price-fundamental-shift-in-trading-2019-3,Tesla's stock doesn't trade like it used to (TSLA),-0.14488684210526317
2019-04-04,https://www.businessinsider.com/tesla-stock-price-delivery-numbers-miss-stoking-demand-concerns-2019-4,Tesla analysts are questioning how many people even want to buy Elon Musk's cars after weak delivery numbers (TSLA),-0.4588
2019-04-04,https://www.businessinsider.com/tesla-q1-2019-production-and-delivery-numbers-2019-4,"Tesla says it delivered about 63,000 vehicles in the first quarter of 2019, a 31% drop from Q4 2018 (TSLA)",-0.2732
2019-04-09,https://www.businessinsider.com/stock-market-news-opening-bell-april-9-2019-2019-4,"10 things you need to know before the opening bell (SPY, SPX, QQQ, DIA, TSLA, AMZN, GOOG)",0.0
2019-03-11,https://www.businessinsider.com/tesla-raising-prices-on-cars-model-3-s-and-x-2019-3,Tesla is raising the prices on cars that it marked down less than 2 weeks ago (TSLA),0.07560322580645161
2019-03-12,https://www.businessinsider.com/stock-market-news-opening-bell-march-12-2019-2019-3,"10 things you need to know before the opening bell (SPY, SPX, QQQ, DIA, TSLA, BA, AAPL, WFC, SFIX)",0.27795
2019-03-14,https://www.businessinsider.com/tesla-stock-price-tesla-in-demand-hell-ahead-of-model-y-bear-says-2019-3,"Tesla is in 'demand hell' ahead of its Model Y unveiling, Wall Street's biggest bear says (TSLA)",0.05655000000000001
2019-04-04,https://markets.businessinsider.com/news/stocks/stock-market-news-opening-bell-april-4-2019-2019-4-1028085583,"10 things you need to know before the opening bell (SPY, SPX, QQQ, DIA, BA, TSLA, LYFT)",-0.14366595744680852
2019-04-05,https://markets.businessinsider.com/news/stocks/stock-market-news-opening-bell-april-5-2019-2019-4-1028088975,"10 things you need to know before the opening bell (SPY, SPX, QQQ, DIA, TSLA, BA, AMZN, TW)",0.07700909090909092
2019-04-04,https://www.businessinsider.com/stock-market-news-opening-bell-april-4-2019-2019-4,"10 things you need to know before the opening bell (SPY, SPX, QQQ, DIA, BA, TSLA, LYFT)",-0.10331176470588235
2019-03-20,https://www.businessinsider.com/tesla-stock-investor-sells-stake-elon-musk-commentary-what-hes-buying-instead-alex-chalekian-2019-3,"A former Tesla investor explains why he thinks Elon Musk is the wrong person to lead the company, why he dumped the stock, and what he’s now buying instead (TSLA)",-0.007234782608695644
2019-03-14,https://www.businessinsider.com/tesla-stock-price-rallies-ahead-of-model-y-unveiling-2019-3,Tesla stock is gaining ground ahead of its Model Y unveiling (TSLA),-0.011510000000000003
2019-04-04,https://markets.businessinsider.com/news/stocks/tesla-stock-price-nearing-key-level-heres-what-pros-say-2019-4-1028087486,Tesla's stock is nearing a key price. Here's what the pros are saying. (TSLA),0.18234999999999998
2019-03-11,https://www.businessinsider.com/tesla-removes-commission-standard-cars-including-35000-model-3-2019-3,Tesla slashed prices for the Model 3 — but took away any incentive for its employees to sell the new version (TSLA),-0.05264166666666667
2019-03-14,https://www.businessinsider.com/tesla-stock-price-tesla-is-in-its-third-stage-of-hell-with-model-3-2019-3,Tesla's in the third version of 'hell' with its Model 3 — and it launching an SUV could make even things worse (TSLA),0.2448583333333333
